,screen_name,description,retired
94156,ShivesSteven,"I am a disabled  Vietnam Veteran serving from 1965 to 1968. I am currently retired from government work.#MAGA#Far right.PATRIOT,TRUMP2020.  ConservativesForever",1
94718,glenford56,"Semi retired retailer ex Asda who now has a life, spends time with his wife running a small cafe and diving twice a week, generally in the sun.",1
95270,CheekyNUFC,"Newcastle Utd Daft, (soon to be retired) love 🎣",1
95459,GeoffDunn2,"15 years self employed, 30 years as a director                       now retired and advising business startups",1
97293,PeterDungey,I'm a retired minister enjoying life in the slow lane,1
97344,mikewhiteaway,Happily retired from engineering enjoying life with my wife Paula married for 40yrs. I enjoy motorcycle touring holidays on my Honda. We have six grandchildren.,1
97773,CarolBr41960083,retired but still working at standing up for this country I love,1
97946,VinceOZ,"Old guy with rooms full of computers and gadgets that hates Leftoids, and Greens. Life is too short to be controlled by idiots, retired now but still can fight!",1
99175,kennyd6666,retired  Truck Driver,1
100864,steelterry,happily retired and playing golf at Wortley Golf Club,1
101332,stevek1134,"Husband, father, retired . Life long Cardiff Devils, Liverpool FC and Cardiff Blues fan and full time Shiba dad.",1
101956,rosymorri,"Mum, Grandma, retired Secretary, Scottish - a Glasgow girl. Tried for years to resist twitter and ignored it, but now I’m becoming hooked - should stop!",1
103123,Ann_MadDogLady,"Semi-retired Petsitter (https://t.co/zfdonenR8p), and sometime avid reader Sometime photographer too. Like driving fast and holidays, preferably hot.",1
103124,LadyMuckOMRLP,"Lady Muck, Minister For Pets And Fluorescent Poo (retired), Official Monster Raving Loony Party. Oh! the loonies out there who are too loony to be Loonys :)",1
103202,Andrew_S_Hatton,"Dyspraxic & retired social worker who cannot get over his concern for criminal justice especially probation. worked in Merseyside, Essex & London.",1
106350,CheshirePete,"Mostly retired, travel a lot. Like politics, poetry, art, cricket, tennis, football, hillwalking, motorcycling, jazz, rock. Lover of life and people.",1
106394,katydid2fury,"Father, grandfather, retired school teacher, trainee guitarist, Chelsea supporter, cycling, feline friend , Labour voter, BA (OU).",1
107150,daizicat,"Deadhead needing like-minded souls to chat.
Likes cats,reading (sci-fi to detective mystery real history & science)
Now retired, worked in health care.",1
107975,julony1,retired,1
108453,icrimages,"Voted brexit, backing Boris. I'm not a racist and are proud of being a white man. A Christian and retired NHS professional. Temptations my favourite band., 🤓😎",1
108774,Dickybeau,"retired support Scottish independence, republicanism, FOM and dog walking. oppose ethnic nationalism,racism,sectarianism",1
110113,Terrygclem,"A Father, Husband, District and Ex County Councillor and retired part time HGV driver. Committed to mental health. Past Mayor of St Edmundsbury 2017-18 🤔",1
111245,Andy01Capp,Guitar playing retired Met police officer. Bowie aficionado. Brexiteer. Conservative voter. Meat eater. Fossil fuel burner. Happily married.,1
112097,thehodge19,"I have a small business 1 retired husband, 2 dogs and a cat. All I want is an easy life.",1
114007,DaveOborne,Psychology Professor (retired). Ergonomist (retired). Amateur cook. European project manager. EU evaluator/rapporteur.,1
114495,wappawappa,"Ex SAR, North Sea, Royal Navy, retired,",1
115382,GlosterEd,Gardening  enthusiast. English. Now retired and living in Cinderford the forest of dean #deanwye #FollowBack,1
116321,SariPestell,"Nana, retired probation officer, observer of life.",1
116636,BarbaraBell17,semi- retired academic in sports development - personal views of sport active lifestyles social justice development,1
116681,stugibb,Gentleman of retired means. Mega-geek & humour consumer. Prolific retweeter.,1
117900,OliverWaugh1,"Semi retired ex soldier, financier and businessman. Active in community initiatives. Use twitter to try to understand different points of view.",1
117927,JoiaGlass,"Wife & Husband team who worked together designing, producing and marketing glass art now retired",1
118335,MaliciousA,"Intergalactic Explorer, Renowned Space Pirate (retired), Style Icon and Master Brewer.",1
119204,philosophy_the,"FREE LISTENING ABSOLUTIST Twitter Novice,NDE, Critical&Creative retired Philosopher, Block swear/insult Like -Discussion & Civil Disagreement,Kindness,Democracy",1
119749,JugglesGerald,Fully retired and busy spouting forth. All views are personal and intended to cause maximum offence,1
122474,melmagtilly,Eavesway coach driver (recently retired) ex- Geography teacher with a fanaticism for Skodas. Keep going with th'ead down.Don't let the buggers grind you down.,1
122604,nickhaynesFAC63,"Life long indie music fanatic..but retired from dancing at 25.
Wine lover..former trade.
Sports punter.
Young at heart..bodywork needs attention.",1
123367,HHinKL,"Liechtensteiner for 20 years 😄then moved to London, lived there for 30+ years, Chelsea Fan😎🤔2008 retired and moved to Kuala Lumpur. Please no DM😀",1
123697,JulianEllacott,"Redhill/Bristol resident, actuary, retired councillor, Conservative. Trustee of @loveworksorg. RTs don’t imply endorsement.",1
123827,davidhchess,Ex CEO now finally completely retired!,1
124542,FarrellTony,28 years in the Royal Navy then Facilities Management role for 12 years in South London. Now retired but  active in the community as a member of Purley Rotary,1
124922,retiredGlosCI,"Personal views of a retired officer. A more enthusiastic than talented cyclist living in the Cotswolds. Policing, Learning and Development",1
124978,lindadenlee,"Retired Legal Accountant after 33 years now enjoying Family history research, travelling and holidays, wish I had retired years ago",1
125451,ShirleyMadin1,"Coal miner’s daughter, grammar school educated, successful senior manager, early retired, happily married. Until they kept May on 12/12 I was a Tory voter.",1
126716,andyburton50,"semi retired ,enjoy all sports , Travel , love South Africa & Spain,Socalist, No deal Brexit ,detest Corbyn 1980s trotski views blocked by my Labour MP",1
127683,MickCarroll6,"#FBPE #RevokeA50 #haveDemocracy Semi-retired voluntary sector manager, consultant and coach. Retweets not necessarily endorsements",1
130401,garethemarc,"retired early hurt, boarded by imperial group za, cant sit for very long. In same boat 10 years later!",1
132339,patriae1776,"Patriot, retired mlitary, Father, entrepreneur, Q anon trooper, Q WWG1WGA flag designer, Molon Labe/'Live Free or Die, death is not the worst of evils'❤🇺🇸❤KAG",1
132714,moragannegreen,"I'm a retired nurse and a staunch Labour🌷supporter. I’m confused about why the country would shun our one chance in decades, to live a better life.",1
132722,jillychapman,Democratic Socialist retired Nurse. Of course I still support Jeremy Corbyn: he's still the leader of the Labour Party; why wouldn't I?,1
